Question,Intent
What is the monthly payment for a \$300,000 mortgage?,mortgage
What is the interest rate on a 30-year fixed mortgage?,mortgage
How much can I afford to borrow for a mortgage?,mortgage
What are the closing costs for a mortgage?,mortgage
What are the different types of mortgages?,mortgage
How long does it take to get a mortgage?,mortgage
What are the requirements for getting a mortgage?,mortgage
What are the benefits of getting a mortgage?,mortgage
What are the risks of getting a mortgage?,mortgage
How can I get a better mortgage rate?,mortgage
How can I refinance my mortgage?,mortgage
What are the different types of mortgage lenders?,mortgage
How can I find a good mortgage lender?,mortgage
What are the different types of mortgage insurance?,mortgage
Do I need mortgage insurance?,mortgage
How much mortgage insurance do I need?,mortgage
How does mortgage insurance work?,mortgage
What are the different types of mortgage calculators?,mortgage
How can I use a mortgage calculator?,mortgage
What are the different types of mortgage documents?,mortgage
What do I need to do to close on a mortgage?,mortgage
What are the different types of mortgage closing costs?,mortgage
What are the different types of mortgage fraud?,mortgage
How can I protect myself from mortgage fraud?,mortgage
How do I calculate my monthly mortgage payment?,mortgage
How do I calculate my mortgage interest?,mortgage
How do I calculate my mortgage taxes?,mortgage
How do I calculate my mortgage insurance?,mortgage
How do I calculate my total mortgage payment?,mortgage
What is the difference between a fixed-rate mortgage and an adjustable-rate mortgage?,mortgage
What is the difference between a conventional mortgage and a government-backed mortgage?,mortgage
What is the difference between a 15-year mortgage and a 30-year mortgage?,mortgage
What is the difference between a jumbo mortgage and a conforming mortgage?,mortgage
What is the difference between a VA mortgage and an FHA mortgage?,mortgage
What is the difference between a USDA mortgage and a USDA Rural Development loan?,mortgage
What is a pre-qualification?,mortgage
What is a pre-approval?,mortgage
What is a closing?,mortgage
What are the different types of closing costs?,mortgage
What is a mortgage escrow account?,mortgage
What is a mortgage payment?,mortgage
What is a mortgage interest rate?,mortgage
What is a mortgage term?,mortgage
What is a mortgage amortization schedule?,mortgage
What is a mortgage default?,mortgage
What is a mortgage foreclosure?,mortgage
What is a mortgage discharge?,mortgage
How do I get a mortgage?,mortgage
What are the steps to getting a mortgage?,mortgage
What are the documents I need to get a mortgage?,mortgage
How long does it take to get a mortgage?,mortgage
What are the risks of getting a mortgage?,mortgage
How can I protect myself from the risks of getting a mortgage?,mortgage
What are the benefits of getting a mortgage?,mortgage
How can I maximize the benefits of getting a mortgage?,mortgage
What are the different types of mortgage lenders?,mortgage
How can I find a good mortgage lender?,mortgage
How can I compare mortgage lenders?,mortgage
How can I negotiate with a mortgage lender?,mortgage
How can I get a better mortgage rate?,mortgage
How can I refinance my mortgage?,mortgage
How can I avoid mortgage fraud?,mortgage
What are the different types of mortgage fraud?,mortgage
How can I protect myself from mortgage fraud?,mortgage